{
  "schemaVersion": 1,
  "version": "2026.10",
  "title": "Introducción a la informática · 100 preguntas para practicar",
  "topics": [
    {
      "id": "T01",
      "title": "Informática, evolución y aplicaciones"
    },
    {
      "id": "T02",
      "title": "Representación y aritmética binaria"
    },
    {
      "id": "T03",
      "title": "Codificación y compresión multimedia"
    },
    {
      "id": "T04",
      "title": "Lógica digital y álgebra de Boole"
    },
    {
      "id": "T05",
      "title": "Arquitectura, CPU e instrucciones"
    },
    {
      "id": "T06",
      "title": "Memoria, almacenamiento e integridad"
    },
    {
      "id": "T07",
      "title": "Buses, periféricos y entrada/salida"
    },
    {
      "id": "T08",
      "title": "Sistemas operativos y procesos"
    },
    {
      "id": "T09",
      "title": "Memoria virtual, archivos y permisos"
    },
    {
      "id": "T10",
      "title": "Software, licencias y mantenimiento"
    },
    {
      "id": "T11",
      "title": "Redes, protocolos y protección"
    },
    {
      "id": "T12",
      "title": "Virtualización, cloud y tecnologías actuales"
    }
  ],
  "questions": [
    {
      "id": "INF-001",
      "topic": "T01",
      "difficulty": "basico",
      "prompt": "¿Qué descripción se ajusta mejor a la informática?",
      "options": [
        {
          "id": "a",
          "text": "El estudio del tratamiento automático de información mediante sistemas computacionales."
        },
        {
          "id": "b",
          "text": "La fabricación de componentes electrónicos, excluyendo programas y datos."
        },
        {
          "id": "c",
          "text": "El uso de navegadores y aplicaciones de oficina, sin estudiar sus fundamentos."
        },
        {
          "id": "d",
          "text": "La conexión de ordenadores a Internet como único campo de estudio."
        }
      ],
      "correctOptionId": "a",
      "explanation": "La informática comprende representación, algoritmos, procesamiento, almacenamiento y comunicación. El uso de aplicaciones es una parte de sus aplicaciones, no toda la disciplina.",
      "study": {
        "label": "D26 · Informática: mapa de conceptos",
        "url": "../#/recurso/D26"
      }
    },
    {
      "id": "INF-002",
      "topic": "T01",
      "difficulty": "basico",
      "prompt": "¿Cuál es la diferencia entre un algoritmo y un programa?",
      "options": [
        {
          "id": "a",
          "text": "Un algoritmo solo existe cuando está conectado a Internet."
        },
        {
          "id": "b",
          "text": "Un algoritmo describe un procedimiento; un programa lo expresa en instrucciones de un lenguaje para ejecutarlo."
        },
        {
          "id": "c",
          "text": "Un algoritmo siempre es hardware y un programa siempre es un archivo de texto."
        },
        {
          "id": "d",
          "text": "Un programa no puede implementar más de un algoritmo."
        }
      ],
      "correctOptionId": "b",
      "explanation": "El algoritmo se razona independientemente de una implementación concreta. El programa concreta instrucciones, tipos, entradas, errores y recursos en un entorno de ejecución.",
      "study": {
        "label": "D26 · Informática: mapa de conceptos",
        "url": "../#/recurso/D26"
      }
    },
    {
      "id": "INF-003",
      "topic": "T01",
      "difficulty": "intermedio",
      "prompt": "Un archivo contiene el byte hexadecimal 41. ¿Qué puedes afirmar sin conocer su formato?",
      "options": [
        {
          "id": "a",
          "text": "Que necesariamente es una contraseña cifrada."
        },
        {
          "id": "b",
          "text": "Que necesariamente representa el número decimal 41."
        },
        {
          "id": "c",
          "text": "Que contiene un valor de ocho bits; su significado depende de la interpretación."
        },
        {
          "id": "d",
          "text": "Que necesariamente representa una fotografía."
        }
      ],
      "correctOptionId": "c",
      "explanation": "0x41 tiene valor numérico 65, y en ASCII representa A. También podría formar parte de una imagen o instrucción. Los bytes necesitan un formato y un contexto para adquirir significado.",
      "study": {
        "label": "D26 · Informática: mapa de conceptos",
        "url": "../#/recurso/D26"
      }
    },
    {
      "id": "INF-004",
      "topic": "T01",
      "difficulty": "basico",
      "prompt": "¿Qué cambio caracteriza el concepto de programa almacenado?",
      "options": [
        {
          "id": "a",
          "text": "Los programas deben estar cableados físicamente y no pueden modificarse."
        },
        {
          "id": "b",
          "text": "Todos los datos se almacenan exclusivamente en Internet."
        },
        {
          "id": "c",
          "text": "Cada operación requiere que una persona mueva un cable."
        },
        {
          "id": "d",
          "text": "Las instrucciones pueden mantenerse en memoria y ser recuperadas por el procesador."
        }
      ],
      "correctOptionId": "d",
      "explanation": "El programa almacenado permite representar instrucciones en memoria. Esta idea ayuda a explicar la flexibilidad de los ordenadores de propósito general; no implica depender de Internet.",
      "study": {
        "label": "D27 · Historia de la informática",
        "url": "../#/recurso/D27"
      }
    },
    {
      "id": "INF-005",
      "topic": "T01",
      "difficulty": "basico",
      "prompt": "¿Qué relación entre Internet y la Web es correcta?",
      "options": [
        {
          "id": "a",
          "text": "La Web es un servicio que utiliza Internet; Internet también transporta otros servicios."
        },
        {
          "id": "b",
          "text": "Son dos nombres exactos para el mismo protocolo."
        },
        {
          "id": "c",
          "text": "Internet solo existe cuando se utiliza un navegador."
        },
        {
          "id": "d",
          "text": "El correo electrónico es obligatoriamente una página web."
        }
      ],
      "correctOptionId": "a",
      "explanation": "Internet interconecta redes; la Web utiliza tecnologías como URLs, HTTP y HTML. Correo, resolución DNS y muchos otros servicios no se reducen a páginas web.",
      "study": {
        "label": "D27 · Historia de la informática",
        "url": "../#/recurso/D27"
      }
    },
    {
      "id": "INF-006",
      "topic": "T01",
      "difficulty": "aplicacion",
      "prompt": "En una práctica, la web no responde. ¿Qué forma de proceder permite obtener una conclusión respaldada por evidencia?",
      "options": [
        {
          "id": "a",
          "text": "Atribuir el fallo al país de una IP sin examinar el servicio."
        },
        {
          "id": "b",
          "text": "Registrar el error, las condiciones y las comprobaciones antes de atribuir una causa."
        },
        {
          "id": "c",
          "text": "Afirmar que existe un ataque porque el navegador mostró un error."
        },
        {
          "id": "d",
          "text": "Reinstalar el sistema y declarar resuelto el incidente sin comprobar nada."
        }
      ],
      "correctOptionId": "b",
      "explanation": "Un síntoma puede tener varias causas. El diagnóstico separa observación, hipótesis y prueba; documenta versión, fecha, comandos y límites antes de atribuir el fallo.",
      "study": {
        "label": "D26 · Informática: mapa de conceptos",
        "url": "../#/recurso/D26"
      }
    },
    {
      "id": "INF-007",
      "topic": "T02",
      "difficulty": "aplicacion",
      "prompt": "¿A qué número decimal equivale 101101 en binario?",
      "options": [
        {
          "id": "a",
          "text": "46"
        },
        {
          "id": "b",
          "text": "53"
        },
        {
          "id": "c",
          "text": "45"
        },
        {
          "id": "d",
          "text": "41"
        }
      ],
      "correctOptionId": "c",
      "explanation": "Los bits activos representan 32 + 8 + 4 + 1 = 45. La posición, desde la derecha, indica potencias de dos empezando por 2 elevado a 0.",
      "study": {
        "label": "D41 · Representación y codificación",
        "url": "../#/recurso/D41"
      }
    },
    {
      "id": "INF-008",
      "topic": "T02",
      "difficulty": "aplicacion",
      "prompt": "¿Cuál es la representación binaria del número decimal 13?",
      "options": [
        {
          "id": "a",
          "text": "1011"
        },
        {
          "id": "b",
          "text": "1110"
        },
        {
          "id": "c",
          "text": "1001"
        },
        {
          "id": "d",
          "text": "1101"
        }
      ],
      "correctOptionId": "d",
      "explanation": "13 = 8 + 4 + 1, por lo que los bits de pesos 8, 4 y 1 están activos: 1101. Añadir ceros a la izquierda no cambia el valor.",
      "study": {
        "label": "D41 · Representación y codificación",
        "url": "../#/recurso/D41"
      }
    },
    {
      "id": "INF-009",
      "topic": "T02",
      "difficulty": "aplicacion",
      "prompt": "¿A qué valor decimal equivale 2F en hexadecimal?",
      "options": [
        {
          "id": "a",
          "text": "47"
        },
        {
          "id": "b",
          "text": "32"
        },
        {
          "id": "c",
          "text": "215"
        },
        {
          "id": "d",
          "text": "31"
        }
      ],
      "correctOptionId": "a",
      "explanation": "En hexadecimal, F vale 15. Por tanto, 0x2F = 2 × 16 + 15 = 47. El prefijo 0x indica la base, no forma parte del valor.",
      "study": {
        "label": "D41 · Representación y codificación",
        "url": "../#/recurso/D41"
      }
    },
    {
      "id": "INF-010",
      "topic": "T02",
      "difficulty": "aplicacion",